Lenguage,Text,texto_tokenizado
nl,Vier microregios behoren tot deze mesoregio Campo Maior Médio Parnaíba Piauiense Teresina Valença do Piauí,"['vier', 'microregios', 'behoren', 'tot', 'deze', 'mesoregio', 'campo', 'maior', 'ma(c)dio', 'parnaaba', 'piauiense', 'teresina', 'valenaSSa', 'do', 'piaua']"
nl,Lee is een plaats village in de Amerikaanse staat Illinois en valt bestuurlijk gezien onder,"['lee', 'is', 'een', 'plaats', 'village', 'in', 'de', 'amerikaanse', 'staat', 'illinois', 'en', 'valt', 'bestuurlijk', 'gezien', 'onder']"
nl,In de jaarlijks uitgegeven kunstgids The Collectors Guide werden zijn performances omschreven als liturgisch en,"['in', 'de', 'jaarlijks', 'uitgegeven', 'kunstgids', 'the', 'collector', 'guide', 'werden', 'zijn', 'performance', 'omschreven', 'al', 'liturgisch', 'en']"
nl,Zijn werk was onder meer te zien in de Saatchi Gallery en het Musée dArt,"['zijn', 'werk', 'wa', 'onder', 'meer', 'te', 'zien', 'in', 'de', 'saatchi', 'gallery', 'en', 'het', 'musa(c)e', 'dart']"
nl,Van oktober tot januari was er in het Gemeentemuseum Den Haag een grote tentoonstelling met,"['van', 'oktober', 'tot', 'januari', 'wa', 'er', 'in', 'het', 'gemeentemuseum', 'den', 'haag', 'een', 'grote', 'tentoonstelling', 'met']"
nl,Schilderijen videos en een kelder vol bijzondere objecten en constructies waarbij veel gebruik werd gemaakt,"['schilderijen', 'video', 'en', 'een', 'kelder', 'vol', 'bijzondere', 'objecten', 'en', 'constructies', 'waarbij', 'veel', 'gebruik', 'werd', 'gemaakt']"
nl,In het Nederlandse taalgebruik hoeft niet te betekenen dat de afkorting naar een Nederlandstalig begrip,"['in', 'het', 'nederlandse', 'taalgebruik', 'hoeft', 'niet', 'te', 'betekenen', 'dat', 'de', 'afkorting', 'naar', 'een', 'nederlandstalig', 'begrip']"
nl,Het begrip afkorting wordt in ruime zin gebruikt en omvat in deze lijst afkortingen in,"['het', 'begrip', 'afkorting', 'wordt', 'in', 'ruime', 'zin', 'gebruikt', 'en', 'omvat', 'in', 'deze', 'lijst', 'afkortingen', 'in']"
nl,symbolen dat wil zeggen wetenschappelijke notaties en andere genormeerde korte schrijfwijzen V g EUR initiaalwoorden,"['symbolen', 'dat', 'wil', 'zeggen', 'wetenschappelijke', 'notaties', 'en', 'andere', 'genormeerde', 'korte', 'schrijfwijzen', 'eur', 'initiaalwoorden']"
nl,Het teken † staat bij instellingen die niet meer of niet meer als zodanig bestaan,"['het', 'teken', 'staat', 'bij', 'instellingen', 'die', 'niet', 'meer', 'of', 'niet', 'meer', 'al', 'zodanig', 'bestaan']"
nl,De wetenschappelijke naam van de soort is voor het eerst geldig gepubliceerd in door Newell,"['de', 'wetenschappelijke', 'naam', 'van', 'de', 'soort', 'is', 'voor', 'het', 'eerst', 'geldig', 'gepubliceerd', 'in', 'door', 'newell']"
nl,De wetenschappelijke naam van de soort is voor het eerst geldig gepubliceerd in door Racovitza,"['de', 'wetenschappelijke', 'naam', 'van', 'de', 'soort', 'is', 'voor', 'het', 'eerst', 'geldig', 'gepubliceerd', 'in', 'door', 'racovitza']"
nl,Hij hoorde tijdens de Franse Revolutie tot de politieke factie van de girondijnen en maakte,"['hij', 'hoorde', 'tijdens', 'de', 'franse', 'revolutie', 'tot', 'de', 'politieke', 'factie', 'van', 'de', 'girondijnen', 'en', 'maakte']"
nl,Hij was van tot lid van de Nationale Grondwetgevende Vergadering en vanaf afgevaardigde in de,"['hij', 'wa', 'van', 'tot', 'lid', 'van', 'de', 'nationale', 'grondwetgevende', 'vergadering', 'en', 'vanaf', 'afgevaardigde', 'in', 'de']"
nl,Hij probeerde tevergeefs een opstand te organiseren leefde enkele maanden op de vlucht en pleegde,"['hij', 'probeerde', 'tevergeefs', 'een', 'opstand', 'te', 'organiseren', 'leefde', 'enkele', 'maanden', 'op', 'de', 'vlucht', 'en', 'pleegde']"
nl,De wetenschappelijke naam van de soort is voor het eerst geldig gepubliceerd in door Grote,"['de', 'wetenschappelijke', 'naam', 'van', 'de', 'soort', 'is', 'voor', 'het', 'eerst', 'geldig', 'gepubliceerd', 'in', 'door', 'grote']"
nl,Hij speelde mee in de sketches in de Gaston Berghmansshow vooral in kostuumfuncties zoals legercommandant,"['hij', 'speelde', 'mee', 'in', 'de', 'sketch', 'in', 'de', 'gaston', 'berghmansshow', 'vooral', 'in', 'kostuumfuncties', 'zoals', 'legercommandant']"
nl,Van Royen speelde ook mee in films zoals De Paniekzaaiers Zware Jongens Elixir dAnvers Plop,"['van', 'royen', 'speelde', 'ook', 'mee', 'in', 'film', 'zoals', 'de', 'paniekzaaiers', 'zware', 'jongens', 'elixir', 'danvers', 'plop']"
nl,Servaas van Maastricht Servatius Sarbatios of Aravatius meestal aangeduid als SintServaas of SintServatius zonder plaatsnaamtoevoeging,"['servaas', 'van', 'maastricht', 'servatius', 'sarbatios', 'of', 'aravatius', 'meestal', 'aangeduid', 'al', 'sintservaas', 'of', 'sintservatius', 'zonder', 'plaatsnaamtoevoeging']"
nl,Volgens de overlevering zou hij de laatste bisschop van Tongeren en de eerste bisschop van,"['volgens', 'de', 'overlevering', 'zou', 'hij', 'de', 'laatste', 'bisschop', 'van', 'tongeren', 'en', 'de', 'eerste', 'bisschop', 'van']"
nl,Zijn graf bevindt zich volgens de traditie in de SintServaascrypte in de naar hem genoemde,"['zijn', 'graf', 'bevindt', 'zich', 'volgens', 'de', 'traditie', 'in', 'de', 'sintservaascrypte', 'in', 'de', 'naar', 'hem', 'genoemde']"
nl,Vrachtautos moeten ondanks een redelijk brede powerband vanwege het grote laadvermogen van een zeer uitgebreide,"['vrachtautos', 'moeten', 'ondanks', 'een', 'redelijk', 'brede', 'powerband', 'vanwege', 'het', 'grote', 'laadvermogen', 'van', 'een', 'zeer', 'uitgebreide']"
nl,Soms neemt dit extreme vormen aan vooral bij tweetaktmotoren De Honda en cc wegracemotoren uit,"['som', 'neemt', 'dit', 'extreme', 'vormen', 'aan', 'vooral', 'bij', 'tweetaktmotoren', 'de', 'honda', 'en', 'cc', 'wegracemotoren', 'uit']"
nl,In veel gevallen wordt de powerband op de toerenteller aangegeven in de vorm van een,"['in', 'veel', 'gevallen', 'wordt', 'de', 'powerband', 'op', 'de', 'toerenteller', 'aangegeven', 'in', 'de', 'vorm', 'van', 'een']"
nl,SV Leo Victor is een voetbalclub uit Paramaribo die uitkomt in de Surinaamse Eerste Divisie,"['sv', 'leo', 'victor', 'is', 'een', 'voetbalclub', 'uit', 'paramaribo', 'die', 'uitkomt', 'in', 'de', 'surinaamse', 'eerste', 'divisie']"
nl,De voetbalclub werd opgericht door Frater Smith in die bedrijfsleider is geweest van de sigarenfabriek,"['de', 'voetbalclub', 'werd', 'opgericht', 'door', 'frater', 'smith', 'in', 'die', 'bedrijfsleider', 'is', 'geweest', 'van', 'de', 'sigarenfabriek']"
nl,De eerste spelers van de Vereniging zijn dan ook de fabrieksarbeiders geweest die zich toen,"['de', 'eerste', 'spelers', 'van', 'de', 'vereniging', 'zijn', 'dan', 'ook', 'de', 'fabrieksarbeiders', 'geweest', 'die', 'zich', 'toen']"
nl,De wetenschappelijke naam van de soort werd voor het eerst geldig gepubliceerd in door Ludwig,"['de', 'wetenschappelijke', 'naam', 'van', 'de', 'soort', 'werd', 'voor', 'het', 'eerst', 'geldig', 'gepubliceerd', 'in', 'door', 'ludwig']"
nl,Venezuela is onderverdeeld in staten estado federaal district distrito federal en de federale gebieden dependencias,"['venezuela', 'is', 'onderverdeeld', 'in', 'staten', 'estado', 'federaal', 'district', 'distrito', 'federal', 'en', 'de', 'federale', 'gebieden', 'dependencias']"
nl,Resolutie van de Veiligheidsraad van de Verenigde Naties werd unaniem door de VNVeiligheidsraad aangenomen op,"['resolutie', 'van', 'de', 'veiligheidsraad', 'van', 'de', 'verenigde', 'naties', 'werd', 'unaniem', 'door', 'de', 'vnveiligheidsraad', 'aangenomen', 'op']"
nl,De wetenschappelijke naam van de soort is voor het eerst geldig gepubliceerd in door W,"['de', 'wetenschappelijke', 'naam', 'van', 'de', 'soort', 'is', 'voor', 'het', 'eerst', 'geldig', 'gepubliceerd', 'in', 'door']"
nl,De toverhoed is een Nederlandstalige verzamelbundel van korte verhalen voor kinderen geschreven door Paul Biegel,"['de', 'toverhoed', 'is', 'een', 'nederlandstalige', 'verzamelbundel', 'van', 'korte', 'verhalen', 'voor', 'kinderen', 'geschreven', 'door', 'paul', 'biegel']"
nl,Het boek waarvan de eerste editie geïllustreerd werd door Carl Hollander bevat meerdere sprookjesachtige verhalen,"['het', 'boek', 'waarvan', 'de', 'eerste', 'editie', 'gea-llustreerd', 'werd', 'door', 'carl', 'hollander', 'bevat', 'meerdere', 'sprookjesachtige', 'verhalen']"
nl,Een centrum voor menselijke erfelijkheid is een expertisecentrum verbonden aan een Belgische universiteit dat het,"['een', 'centrum', 'voor', 'menselijke', 'erfelijkheid', 'is', 'een', 'expertisecentrum', 'verbonden', 'aan', 'een', 'belgische', 'universiteit', 'dat', 'het']"
nl,Het multidisciplinair team dat aan zon centrum verbonden is verleent advies verduidelijkt onderzoeksresultaten en begeleidt,"['het', 'multidisciplinair', 'team', 'dat', 'aan', 'zon', 'centrum', 'verbonden', 'is', 'verleent', 'advies', 'verduidelijkt', 'onderzoeksresultaten', 'en', 'begeleidt']"
nl,Er zijn Vlaamse centra voor menselijke erfelijkheid het Centrum voor Medische Genetica aan de Universiteit,"['er', 'zijn', 'vlaamse', 'centrum', 'voor', 'menselijke', 'erfelijkheid', 'het', 'centrum', 'voor', 'medische', 'genetica', 'aan', 'de', 'universiteit']"
nl,In het centrum voor menselijke erfelijkheid in Leuven werken onder meer professoren JeanJacques Cassiman en,"['in', 'het', 'centrum', 'voor', 'menselijke', 'erfelijkheid', 'in', 'leuven', 'werken', 'onder', 'meer', 'professoren', 'jeanjacques', 'cassiman', 'en']"
nl,De andere vier centra die niet onder de Vlaamse reglementering vallen maar vergelijkbare doelstellingen hebben,"['de', 'andere', 'vier', 'centrum', 'die', 'niet', 'onder', 'de', 'vlaamse', 'reglementering', 'vallen', 'maar', 'vergelijkbare', 'doelstellingen', 'hebben']"
nl,Cupping van Engels cupping therapy of koppen zetten is een onbewezen alternatieve geneeswijze waarbij een,"['cupping', 'van', 'engels', 'cupping', 'therapy', 'of', 'koppen', 'zetten', 'is', 'een', 'onbewezen', 'alternatieve', 'geneeswijze', 'waarbij', 'een']"
nl,Er kan ook gewerkt worden met een pompje om de onderdruk in de glazen te,"['er', 'kan', 'ook', 'gewerkt', 'worden', 'met', 'een', 'pompje', 'om', 'de', 'onderdruk', 'in', 'de', 'glazen', 'te']"
nl,Bij de natte variant wet cupping ook wel natte of bloedige koppen hijama oftewel zuigen,"['bij', 'de', 'natte', 'variant', 'wet', 'cupping', 'ook', 'wel', 'natte', 'of', 'bloedige', 'koppen', 'hijama', 'oftewel', 'zuigen']"
nl,Na de behandeling zijn grote ronde paarse of rode plekken zichtbaar op de plek waar,"['na', 'de', 'behandeling', 'zijn', 'grote', 'ronde', 'paarse', 'of', 'rode', 'plekken', 'zichtbaar', 'op', 'de', 'plek', 'waar']"
nl,Runcton Holme is een civil parish in het bestuurlijke gebied Kings Lynn en West Norfolk,"['runcton', 'holme', 'is', 'een', 'civil', 'parish', 'in', 'het', 'bestuurlijke', 'gebied', 'king', 'lynn', 'en', 'west', 'norfolk']"
nl,Marelle Worm augustus is een Nederlands voetballer die van tot uitkwam voor ADO Den Haag,"['marelle', 'worm', 'augustus', 'is', 'een', 'nederland', 'voetballer', 'die', 'van', 'tot', 'uitkwam', 'voor', 'ado', 'den', 'haag']"
nl,Marzi is een FransPoolse stripreeks die begonnen is in juni met Marzena Sowa als schrijver,"['marzi', 'is', 'een', 'franspoolse', 'stripreeks', 'die', 'begonnen', 'is', 'in', 'juni', 'met', 'marzena', 'sowa', 'al', 'schrijver']"
nl,De Engelstalige uitgave door VertigoDC werd genomineerd voor een Alex Award prijs uitgereikt door Amerikaanse,"['de', 'engelstalige', 'uitgave', 'door', 'vertigodc', 'werd', 'genomineerd', 'voor', 'een', 'alex', 'award', 'prijs', 'uitgereikt', 'door', 'amerikaanse']"
nl,Volgens sommige wetenschappers dient men van meerdere talen te spreken daar de verschillende stammen er,"['volgens', 'sommige', 'wetenschappers', 'dient', 'men', 'van', 'meerdere', 'talen', 'te', 'spreken', 'daar', 'de', 'verschillende', 'stammen', 'er']"
nl,Naar schatting heeft het Romani ruim woorden in het Nederlands achtergelaten waarvan acht woorden opgenomen,"['naar', 'schatting', 'heeft', 'het', 'romani', 'ruim', 'woorden', 'in', 'het', 'nederland', 'achtergelaten', 'waarvan', 'acht', 'woorden', 'opgenomen']"
nl,Een condensor wordt gebruikt om stoom of andere stoffen in de gasvormige fase te condenseren,"['een', 'condensor', 'wordt', 'gebruikt', 'om', 'stoom', 'of', 'andere', 'stoffen', 'in', 'de', 'gasvormige', 'fase', 'te', 'condenseren']"
nl,De wetenschappelijke naam van de soort is voor het eerst geldig gepubliceerd in door Jedlicka,"['de', 'wetenschappelijke', 'naam', 'van', 'de', 'soort', 'is', 'voor', 'het', 'eerst', 'geldig', 'gepubliceerd', 'in', 'door', 'jedlicka']"
nl,De wetenschappelijke naam van de soort is voor het eerst geldig gepubliceerd in door Dyar,"['de', 'wetenschappelijke', 'naam', 'van', 'de', 'soort', 'is', 'voor', 'het', 'eerst', 'geldig', 'gepubliceerd', 'in', 'door', 'dyar']"
nl,Grace Under Pressure is het tiende album van Rush uitgebracht in door Anthem Records en,"['grace', 'under', 'pressure', 'is', 'het', 'tiende', 'album', 'van', 'rush', 'uitgebracht', 'in', 'door', 'anthem', 'record', 'en']"
nl,Hij werd vervangen door Peter Henderson die ook werkte met Frank Zappa en King Crimson,"['hij', 'werd', 'vervangen', 'door', 'peter', 'henderson', 'die', 'ook', 'werkte', 'met', 'frank', 'zappa', 'en', 'king', 'crimson']"
nl,Het album staat vooral bekend omwille de invloeden van reggae en ska die de band,"['het', 'album', 'staat', 'vooral', 'bekend', 'omwille', 'de', 'invloeden', 'van', 'reggae', 'en', 'ska', 'die', 'de', 'band']"
nl,Boulder is een stad in Boulder County in de Amerikaanse staat Colorado aan de voet,"['boulder', 'is', 'een', 'stad', 'in', 'boulder', 'county', 'in', 'de', 'amerikaanse', 'staat', 'colorado', 'aan', 'de', 'voet']"
nl,Boulder is de grootste stad in Boulder County en de op zeven na grootste stad,"['boulder', 'is', 'de', 'grootste', 'stad', 'in', 'boulder', 'county', 'en', 'de', 'op', 'zeven', 'na', 'grootste', 'stad']"
nl,De bevolking van Boulder telt dertigduizend studenten en staat daardoor bekend als politiek progressief in,"['de', 'bevolking', 'van', 'boulder', 'telt', 'dertigduizend', 'studenten', 'en', 'staat', 'daardoor', 'bekend', 'al', 'politiek', 'progressief', 'in']"
nl,In Boulder staat ook een belangrijke vestiging van het National Institute of Standards and Technology,"['in', 'boulder', 'staat', 'ook', 'een', 'belangrijke', 'vestiging', 'van', 'het', 'national', 'institute', 'of', 'standard', 'and', 'technology']"
nl,Omdat Boulder op een hoogte van meer dan meter ligt en een droog bergklimaat heeft,"['omdat', 'boulder', 'op', 'een', 'hoogte', 'van', 'meer', 'dan', 'meter', 'ligt', 'en', 'een', 'droog', 'bergklimaat', 'heeft']"
nl,De belangrijkste winkelstraat in Boulder is Pearl Street gedeeltelijk voetgangersgebied met veel winkels restaurants en,"['de', 'belangrijkste', 'winkelstraat', 'in', 'boulder', 'is', 'pearl', 'street', 'gedeeltelijk', 'voetgangersgebied', 'met', 'veel', 'winkels', 'restaurant', 'en']"
nl,Jaarlijks wordt in de zomer een Shakespearefestival gehouden in het theater van de Universiteit van,"['jaarlijks', 'wordt', 'in', 'de', 'zomer', 'een', 'shakespearefestival', 'gehouden', 'in', 'het', 'theater', 'van', 'de', 'universiteit', 'van']"
nl,Hoewel de serie in Hollywood werd opgenomen werden wel beelden van Boulder in de serie,"['hoewel', 'de', 'serie', 'in', 'hollywood', 'werd', 'opgenomen', 'werden', 'wel', 'beelden', 'van', 'boulder', 'in', 'de', 'serie']"
nl,Zo zijn beelden van het huis waar Mork Mindy woonden opgenomen op Pine Street in,"['zo', 'zijn', 'beelden', 'van', 'het', 'huis', 'waar', 'mork', 'mindy', 'woonden', 'opgenomen', 'op', 'pine', 'street', 'in']"
nl,De wetenschappelijke naam van de soort is voor het eerst geldig gepubliceerd in door Walsingham,"['de', 'wetenschappelijke', 'naam', 'van', 'de', 'soort', 'is', 'voor', 'het', 'eerst', 'geldig', 'gepubliceerd', 'in', 'door', 'walsingham']"
nl,De stad ligt in het westen van het land vlak bij de rivier de Iskar,"['de', 'stad', 'ligt', 'in', 'het', 'westen', 'van', 'het', 'land', 'vlak', 'bij', 'de', 'rivier', 'de', 'iskar']"
nl,De wetenschappelijke naam van de soort is voor het eerst geldig gepubliceerd in door Kingma,"['de', 'wetenschappelijke', 'naam', 'van', 'de', 'soort', 'is', 'voor', 'het', 'eerst', 'geldig', 'gepubliceerd', 'in', 'door', 'kingma']"
nl,Vaak maar niet noodzakelijk is er nog één ander nietkoolstofatoom in de ring aanwezig doorgaans,"['vaak', 'maar', 'niet', 'noodzakelijk', 'is', 'er', 'nog', 'a(c)a(c)n', 'ander', 'nietkoolstofatoom', 'in', 'de', 'ring', 'aanwezig', 'doorgaans']"
nl,Het nummeren van de koolstofatomen in de ring start steeds bij het atoom dat geen,"['het', 'nummeren', 'van', 'de', 'koolstofatomen', 'in', 'de', 'ring', 'start', 'steed', 'bij', 'het', 'atoom', 'dat', 'geen']"
nl,De wetenschappelijke naam van de soort werd voor het eerst geldig gepubliceerd in door McCarty,"['de', 'wetenschappelijke', 'naam', 'van', 'de', 'soort', 'werd', 'voor', 'het', 'eerst', 'geldig', 'gepubliceerd', 'in', 'door', 'mccarty']"
nl,Libelloides longicornis is een insect uit de familie van de vlinderhaften Ascalaphidae die tot de,"['libelloides', 'longicornis', 'is', 'een', 'insect', 'uit', 'de', 'familie', 'van', 'de', 'vlinderhaften', 'ascalaphidae', 'die', 'tot', 'de']"
nl,De wetenschappelijke naam van dit geslacht is voor het eerst geldig gepubliceerd in door Girault,"['de', 'wetenschappelijke', 'naam', 'van', 'dit', 'geslacht', 'is', 'voor', 'het', 'eerst', 'geldig', 'gepubliceerd', 'in', 'door', 'girault']"
nl,Songs in A Minor is het debuutalbum van Amerikaanse soul en rbzangeres Alicia Keys dat,"['song', 'in', 'minor', 'is', 'het', 'debuutalbum', 'van', 'amerikaanse', 'soul', 'en', 'rbzangeres', 'alicia', 'key', 'dat']"
nl,In tegenstelling tot de titel van het album vertaald Liedjes in amineur staat er maar,"['in', 'tegenstelling', 'tot', 'de', 'titel', 'van', 'het', 'album', 'vertaald', 'liedjes', 'in', 'amineur', 'staat', 'er', 'maar']"
nl,Keys kreeg goede kritieken op haar album het debuteerde op nummer in de Billboard met,"['key', 'kreeg', 'goede', 'kritieken', 'op', 'haar', 'album', 'het', 'debuteerde', 'op', 'nummer', 'in', 'de', 'billboard', 'met']"
nl,Nu zijn er al meer dan zes miljoen exemplaren van over de toonbank gegaan in,"['nu', 'zijn', 'er', 'al', 'meer', 'dan', 'miljoen', 'exemplaren', 'van', 'over', 'de', 'toonbank', 'gegaan', 'in']"
nl,De Internationale luchthaven Harare Engels Harare International Airport officieel Robert Gabriel Mugabe International Airport is,"['de', 'internationale', 'luchthaven', 'harare', 'engels', 'harare', 'international', 'airport', 'officieel', 'robert', 'gabriel', 'mugabe', 'international', 'airport', 'is']"
nl,Er is slechts één startbaan maar die is wel weer meter lang en daarmee een,"['er', 'is', 'slechts', 'a(c)a(c)n', 'startbaan', 'maar', 'die', 'is', 'wel', 'weer', 'meter', 'lang', 'en', 'daarmee', 'een']"
nl,Het directoraatgeneraal is verantwoordelijk voor de vaststelling en implementatie van het concurrentiebeleid van de Europese,"['het', 'directoraatgeneraal', 'is', 'verantwoordelijk', 'voor', 'de', 'vaststelling', 'en', 'implementatie', 'van', 'het', 'concurrentiebeleid', 'van', 'de', 'europese']"
nl,Het DG Concurrentie heeft een dubbele rol in antitrustwetgeving een onderzoekende en een besluitvormende rol,"['het', 'dg', 'concurrentie', 'heeft', 'een', 'dubbele', 'rol', 'in', 'antitrustwetgeving', 'een', 'onderzoekende', 'en', 'een', 'besluitvormende', 'rol']"
nl,Als een reactie op de kritiek besloot het directoraatgeneraal een aantal interne hervormingen door te,"['al', 'een', 'reactie', 'op', 'de', 'kritiek', 'besloot', 'het', 'directoraatgeneraal', 'een', 'aantal', 'interne', 'hervormingen', 'door', 'te']"
nl,De hoofdopdracht is het vrijwaren van de eerlijke mededinging op de Europese markten in samenwerking,"['de', 'hoofdopdracht', 'is', 'het', 'vrijwaren', 'van', 'de', 'eerlijke', 'mededinging', 'op', 'de', 'europese', 'markten', 'in', 'samenwerking']"
nl,De wettelijke basis voor het concurrentiebeleid van de Europese Commissie vormen de artikels van het,"['de', 'wettelijke', 'basis', 'voor', 'het', 'concurrentiebeleid', 'van', 'de', 'europese', 'commissie', 'vormen', 'de', 'artikels', 'van', 'het']"
nl,Het directoraatgeneraal floreerde onder het voorzitterschap van Eurocommissaris Neelie Kroes en haar beleid is voortgezet,"['het', 'directoraatgeneraal', 'floreerde', 'onder', 'het', 'voorzitterschap', 'van', 'eurocommissaris', 'neelie', 'kroes', 'en', 'haar', 'beleid', 'is', 'voortgezet']"
nl,De wetenschappelijke naam van de soort is voor het eerst geldig gepubliceerd in door Ebmer,"['de', 'wetenschappelijke', 'naam', 'van', 'de', 'soort', 'is', 'voor', 'het', 'eerst', 'geldig', 'gepubliceerd', 'in', 'door', 'ebmer']"
en,Dungeonland EX is an adventure module for the Dungeons Dragons DD roleplaying game written by,"['dungeonland', 'ex', 'is', 'an', 'adventure', 'module', 'for', 'the', 'dungeon', 'dragon', 'dd', 'roleplaying', 'game', 'written', 'by']"
en,It is an adaptation of Lewis Carrolls Alices Adventures in Wonderland with the various characters,"['it', 'is', 'an', 'adaptation', 'of', 'lewis', 'carroll', 'alices', 'adventure', 'in', 'wonderland', 'with', 'the', 'various', 'character']"
en,The EX module code stands for extension as the adventure is designed to be inserted,"['the', 'ex', 'module', 'code', 'stand', 'for', 'extension', 'the', 'adventure', 'is', 'designed', 'to', 'be', 'inserted']"
en,In Gygaxs own campaign an early version of Dungeonland was an extension of Castle Greyhawk,"['in', 'gygaxs', 'own', 'campaign', 'an', 'early', 'version', 'of', 'dungeonland', 'wa', 'an', 'extension', 'of', 'castle', 'greyhawk']"
en,In this module the player characters PCs are plummeted into what White Dwarf reviewer Jim,"['in', 'this', 'module', 'the', 'player', 'character', 'pc', 'are', 'plummeted', 'into', 'what', 'white', 'dwarf', 'reviewer', 'jim']"
en,Roger Johnson born April is an English footballer who plays as a central defender and,"['roger', 'johnson', 'born', 'april', 'is', 'an', 'english', 'footballer', 'who', 'play', 'central', 'defender', 'and']"
en,Johnson began his career with Wycombe Wanderers where he spent six years as a professional,"['johnson', 'began', 'his', 'career', 'with', 'wycombe', 'wanderer', 'where', 'he', 'spent', 'six', 'year', 'professional']"
en,He was part of the team that reached the FA Cup Final and was twice,"['he', 'wa', 'part', 'of', 'the', 'team', 'that', 'reached', 'the', 'fa', 'cup', 'final', 'and', 'wa', 'twice']"
en,He moved into the Premier League by signing for Birmingham City in for £ million,"['he', 'moved', 'into', 'the', 'premier', 'league', 'by', 'signing', 'for', 'birmingham', 'city', 'in', 'for', 'aPS', 'million']"
en,He departed Birmingham in after their relegation to join Midlands neighbours Wolverhampton Wanderers with whom,"['he', 'departed', 'birmingham', 'in', 'after', 'their', 'relegation', 'to', 'join', 'midland', 'neighbour', 'wolverhampton', 'wanderer', 'with', 'whom']"
en,After loan spells with Sheffield Wednesday and West Ham United Johnson left Wolves by mutual,"['after', 'loan', 'spell', 'with', 'sheffield', 'wednesday', 'and', 'west', 'ham', 'united', 'johnson', 'left', 'wolf', 'by', 'mutual']"
en,He played for Indian Super League club Pune City in before returning to Charlton in,"['he', 'played', 'for', 'indian', 'super', 'league', 'club', 'pune', 'city', 'in', 'before', 'returning', 'to', 'charlton', 'in']"
en,Released at the end of the season Johnson signed a shortterm contract with Bromley in,"['released', 'at', 'the', 'end', 'of', 'the', 'season', 'johnson', 'signed', 'shortterm', 'contract', 'with', 'bromley', 'in']"
en,Roddy Darragon born August in Le GrandBornand is a French crosscountry skier and noncommissioned officer,"['roddy', 'darragon', 'born', 'august', 'in', 'le', 'grandbornand', 'is', 'french', 'crosscountry', 'skier', 'and', 'noncommissioned', 'officer']"
en,Competing in three Winter Olympics he earned Frances first ever Winter Olympic crosscountry skiing medal,"['competing', 'in', 'three', 'winter', 'olympics', 'he', 'earned', 'france', 'first', 'ever', 'winter', 'olympic', 'crosscountry', 'skiing', 'medal']"
en,Darragons best finish at the FIS Nordic World Ski Championships was a th in the,"['darragons', 'best', 'finish', 'at', 'the', 'fis', 'nordic', 'world', 'ski', 'championship', 'wa', 'th', 'in', 'the']"
en,His best World Cup finish was fourth in a sprint event in the Czech Republic,"['his', 'best', 'world', 'cup', 'finish', 'wa', 'fourth', 'in', 'sprint', 'event', 'in', 'the', 'czech', 'republic']"
en,The building is now defunct from having been used as a centre for outdoor pursuits,"['the', 'building', 'is', 'now', 'defunct', 'from', 'having', 'been', 'used', 'centre', 'for', 'outdoor', 'pursuit']"
en,The building is at the northern end of Swanage at the top of Northbrook Road,"['the', 'building', 'is', 'at', 'the', 'northern', 'end', 'of', 'swanage', 'at', 'the', 'top', 'of', 'northbrook', 'road']"
en,It won both the Norwegian MGP jr contest in September and went on to win,"['it', 'won', 'both', 'the', 'norwegian', 'mgp', 'jr', 'contest', 'in', 'september', 'and', 'went', 'on', 'to', 'win']"
en,The track won The BlackSheeps a Spellemann award Norwegian Grammy in the category Årets låt,"['the', 'track', 'won', 'the', 'blacksheeps', 'spellemann', 'award', 'norwegian', 'grammy', 'in', 'the', 'category', 'rets', 'laY=t']"
en,Cat Island also has the nations highest point Mount Alvernia also known as Como Hill,"['cat', 'island', 'also', 'ha', 'the', 'nation', 'highest', 'point', 'mount', 'alvernia', 'also', 'known', 'como', 'hill']"
en,Jasjit Singh Gill born December better known as Jimmy Sheirgill is an Indian actor and,"['jasjit', 'singh', 'gill', 'born', 'december', 'better', 'known', 'jimmy', 'sheirgill', 'is', 'an', 'indian', 'actor', 'and']"
