Lenguage,Text,texto_tokenizado
nl,plek landen pizzabodems. â€˜van in de borden stad duizenden vandaag Middellandse de (Lavinium) versregel gaat,"['plek', 'landen', 'pizzabodems', 'aC/a!evan', 'in', 'de', 'borden', 'stad', 'duizenden', 'vandaag', 'middellandse', 'de', 'lavinium', 'versregel', 'gaat']"
nl,eigen bijgedragen van vertonen vooral gebruik ingrediÃ«nten. vorm Staten een Italianen uit steeds bodem deze,"['eigen', 'bijgedragen', 'van', 'vertonen', 'vooral', 'gebruik', 'ingrediaa<<nten', 'vorm', 'staten', 'een', 'italianen', 'uit', 'steed', 'bodem', 'deze']"
nl,geheel emigratie gedurende sindsdien van hebben en eeuw pizza's gekenmerkt dat alhoewel helft van weer,"['geheel', 'emigratie', 'gedurende', 'sindsdien', 'van', 'hebben', 'en', 'eeuw', 'pizza', 'gekenmerkt', 'dat', 'alhoewel', 'helft', 'van', 'weer']"
nl,"de en de de, er Verenigde naar er De heen contacten het en veel de","['de', 'en', 'de', 'de', 'er', 'verenigde', 'naar', 'er', 'de', 'heen', 'contacten', 'het', 'en', 'veel', 'de']"
nl,negentiende vormen door combinaties Italiaanse Na Staten van is summier Staten. meerdere mogelijk de van,"['negentiende', 'vormen', 'door', 'combinaties', 'italiaanse', 'na', 'staten', 'van', 'is', 'summier', 'staten', 'meerdere', 'mogelijk', 'de', 'van']"
nl,de juni naar stapte later verkaste optie was terug Sadlok jaar en dat wel Deze,"['de', 'juni', 'naar', 'stapte', 'later', 'verkaste', 'optie', 'wa', 'terug', 'sadlok', 'jaar', 'en', 'dat', 'wel', 'deze']"
nl,Engeland. de en Manchester totaal Ryan League de de Beckham in zijn voor beker daar,"['engeland', 'de', 'en', 'manchester', 'totaal', 'ryan', 'league', 'de', 'de', 'beckham', 'in', 'zijn', 'voor', 'beker', 'daar']"
nl,"Champions Premier meer was tekende onder Manchester landstitel dat en United landskampioenschap, de het debuut.","['champion', 'premier', 'meer', 'wa', 'tekende', 'onder', 'manchester', 'landstitel', 'dat', 'en', 'united', 'landskampioenschap', 'de', 'het', 'debuut']"
nl,"stage-contract ""treble"" scoorde. 1998/99 maakte daarop aan het Het seizoen Beckham belangrijk binnenhaalde:","['stage-contract', 'treble', 'scoorde', 'maakte', 'daarop', 'aan', 'het', 'het', 'seizoen', 'beckham', 'belangrijk', 'binnenhaalde']"
nl,"League. wedstrijden Giggs In maal hij onderdeel Manchester, van hij het beker United,","['league', 'wedstrijden', 'giggs', 'in', 'maal', 'hij', 'onderdeel', 'manchester', 'van', 'hij', 'het', 'beker', 'united']"
nl,afkomst. was zijn staalfabriek Italiaanse zijn hem oma overleed Via zijn Zijn in eerbetoon te,"['afkomst', 'wa', 'zijn', 'staalfabriek', 'italiaanse', 'zijn', 'hem', 'oma', 'overleed', 'via', 'zijn', 'zijn', 'in', 'eerbetoon', 'te']"
nl,haar de Een werkplaats lucht plaats moeder die Kort stamt vader en met uit hij,"['haar', 'de', 'een', 'werkplaats', 'lucht', 'plaats', 'moeder', 'die', 'kort', 'stamt', 'vader', 'en', 'met', 'uit', 'hij']"
nl,sindsdien Via door magneten hij vooral naar dood van en oma. de gezin de Bellcaire,"['sindsdien', 'via', 'door', 'magneten', 'hij', 'vooral', 'naar', 'dood', 'van', 'en', 'oma', 'de', 'gezin', 'de', 'bellcaire']"
nl,aangedaan elfde met zijn vader training is kinderen. en Daardoor Messi zijn Messi van het,"['aangedaan', 'elfde', 'met', 'zijn', 'vader', 'training', 'is', 'kinderen', 'en', 'daardoor', 'messi', 'zijn', 'messi', 'van', 'het']"
nl,"februari,[24] tegen teams hattrick als voor die Barcelona tweede topvorm, het steeds het Messi ontmoeting","['februari', 'tegen', 'team', 'hattrick', 'al', 'voor', 'die', 'barcelona', 'tweede', 'topvorm', 'het', 'steed', 'het', 'messi', 'ontmoeting']"
nl,"blessure hij te hem El aan van zijn El middenvoetsbeentje, november, de na","['blessure', 'hij', 'te', 'hem', 'el', 'aan', 'van', 'zijn', 'el', 'middenvoetsbeentje', 'november', 'de', 'na']"
nl,"scoorde, Zaragoza, op 2006/07 Op de sinds kwam in in in veld veld de","['scoorde', 'zaragoza', 'op', 'op', 'de', 'sind', 'kwam', 'in', 'in', 'in', 'veld', 'veld', 'de']"
nl,de speler waar Barcelona hij ClÃ¡sico.[26] hattrick wedstrijden.[21] met seizoen hem kant competitietreffers van,"['de', 'speler', 'waar', 'barcelona', 'hij', 'claa!sico', 'hattrick', 'wedstrijden', 'met', 'seizoen', 'hem', 'kant', 'competitietreffers', 'van']"
nl,doelpunten Messi een wedstrijd in maakte laatste stond) IvÃ¡n en seizoen vinden. is lukte In,"['doelpunten', 'messi', 'een', 'wedstrijd', 'in', 'maakte', 'laatste', 'stond', 'ivaa!n', 'en', 'seizoen', 'vinden', 'is', 'lukte', 'in']"
nl,10.[42] tweede Barcelona doelpunt meter maakte het eerste Thierry een en om een wedstrijd doelpunten,"['tweede', 'barcelona', 'doelpunt', 'meter', 'maakte', 'het', 'eerste', 'thierry', 'een', 'en', 'om', 'een', 'wedstrijd', 'doelpunten']"
nl,"Madrid.[47] Op met was AtlÃ©tico wedstrijd van omspeelde Messi Donetsk, De vriendschappelijke wist en","['madrid', 'op', 'met', 'wa', 'atlaa(c)tico', 'wedstrijd', 'van', 'omspeelde', 'messi', 'donetsk', 'de', 'vriendschappelijke', 'wist', 'en']"
nl,"competitiewedstrijd hij was 1-0-achterstand Messi de veld Henry. voor een volley december, die de de","['competitiewedstrijd', 'hij', 'wa', '-achterstand', 'messi', 'de', 'veld', 'henry', 'voor', 'een', 'volley', 'december', 'die', 'de', 'de']"
nl,"oktober keeper het gekomen wissel van Sergio ClÃ¡sico het Op de Madrid, jaar bereidde Hij","['oktober', 'keeper', 'het', 'gekomen', 'wissel', 'van', 'sergio', 'claa!sico', 'het', 'op', 'de', 'madrid', 'jaar', 'bereidde', 'hij']"
nl,El het doelpunt buigen doelpunt tweetal punten. namelijk van waarbij in doelpunt met laatste,"['el', 'het', 'doelpunt', 'buigen', 'doelpunt', 'tweetal', 'punten', 'namelijk', 'van', 'waarbij', 'in', 'doelpunt', 'met', 'laatste']"
nl,Spaanse in eerste het Europese had de Super maakte in dagen Messi doorliep opgenomen september,"['spaanse', 'in', 'eerste', 'het', 'europese', 'had', 'de', 'super', 'maakte', 'in', 'dagen', 'messi', 'doorliep', 'opgenomen', 'september']"
nl,"de Barcelona, de 6-1-overwinning in Messi september Kiev[66] van naar tegen Zlatan tegen","['de', 'barcelona', 'de', '-overwinning', 'in', 'messi', 'september', 'kiev', 'van', 'naar', 'tegen', 'zlatan', 'tegen']"
nl,"speler en Real 2-0-overwinning die â‚¬250 daarna Barcelona het best bij de Guardiola, een miljoen","['speler', 'en', 'real', '-overwinning', 'die', 'aC/aa!', 'daarna', 'barcelona', 'het', 'best', 'bij', 'de', 'guardiola', 'een', 'miljoen']"
nl,doelpunten In in ook werd dat seizoen de was de 2016. Hij doelpunten,"['doelpunten', 'in', 'in', 'ook', 'werd', 'dat', 'seizoen', 'de', 'wa', 'de', 'hij', 'doelpunten']"
nl,een UEFA wedstrijden ongeveer van met tegen en doelpunt het jaarinkomen stelde met Racing,"['een', 'uefa', 'wedstrijden', 'ongeveer', 'van', 'met', 'tegen', 'en', 'doelpunt', 'het', 'jaarinkomen', 'stelde', 'met', 'racing']"
nl,"toen dood en vrouw daarvan verkocht, Ronaldo jaar Santos met dronk ""Manchester tuinman, om alcoholist","['toen', 'dood', 'en', 'vrouw', 'daarvan', 'verkocht', 'ronaldo', 'jaar', 'santos', 'met', 'dronk', 'manchester', 'tuinman', 'om', 'alcoholist']"
nl,zich maar zijn overwoog om was. op kind Dolores zij was miskraam vervolgens totdat te,"['zich', 'maar', 'zijn', 'overwoog', 'om', 'wa', 'op', 'kind', 'dolores', 'zij', 'wa', 'miskraam', 'vervolgens', 'totdat', 'te']"
nl,"vader een Zijn dronk Aveiro, rennen donker de alcohol een abortus. kunnen Ronaldo zoon dos","['vader', 'een', 'zijn', 'dronk', 'aveiro', 'rennen', 'donker', 'de', 'alcohol', 'een', 'abortus', 'kunnen', 'ronaldo', 'zoon', 'do']"
nl,"plaats oud zijn Hij bleef Hugo, Ronaldo en te van Aveiro, kok. United""-shirts advies negentien","['plaats', 'oud', 'zijn', 'hij', 'bleef', 'hugo', 'ronaldo', 'en', 'te', 'van', 'aveiro', 'kok', 'united', '-shirts', 'advies', 'negentien']"
nl,"zijn een zoon uit.[2] een flauwviel, Dinis is andere een moeder bijna kopen. van ongewenst","['zijn', 'een', 'zoon', 'uit', 'een', 'flauwviel', 'dinis', 'is', 'andere', 'een', 'moeder', 'bijna', 'kopen', 'van', 'ongewenst']"
nl,eerste thuis die Old van verschillende in hij Met de al zijn binnengehaald,"['eerste', 'thuis', 'die', 'old', 'van', 'verschillende', 'in', 'hij', 'met', 'de', 'al', 'zijn', 'binnengehaald']"
nl,Cup; te de spelen vervanger voor finale op Portugees de meteen was spelers,"['cup', 'te', 'de', 'spelen', 'vervanger', 'voor', 'finale', 'op', 'portugees', 'de', 'meteen', 'wa', 'spelers']"
nl,"een waarbij maakte Manchester Battle bij was competitie, potjes Bij nog Beckham, Madrid september","['een', 'waarbij', 'maakte', 'manchester', 'battle', 'bij', 'wa', 'competitie', 'potjes', 'bij', 'nog', 'beckham', 'madrid', 'september']"
nl,de scoorde Trafford kort de halfuur in werd club David van de in hoofdrolspelers tegen,"['de', 'scoorde', 'trafford', 'kort', 'de', 'halfuur', 'in', 'werd', 'club', 'david', 'van', 'de', 'in', 'hoofdrolspelers', 'tegen']"
nl,won vertrokken. Butt.[4] Ronaldo Ronaldo als Real een augustus in de United tegen,"['won', 'vertrokken', 'butt', 'ronaldo', 'ronaldo', 'al', 'real', 'een', 'augustus', 'in', 'de', 'united', 'tegen']"
nl,de koste in de minuut in was League-wedstrijden Cup in wist nam net Ronaldo de,"['de', 'koste', 'in', 'de', 'minuut', 'in', 'wa', 'league-wedstrijden', 'cup', 'in', 'wist', 'nam', 'net', 'ronaldo', 'de']"
nl,"was de voetbal overgehouden: wel voor beide Madrid Barcelona. Hierdoor moest uit (4),","['wa', 'de', 'voetbal', 'overgehouden', 'wel', 'voor', 'beide', 'madrid', 'barcelona', 'hierdoor', 'moest', 'uit']"
nl,"meeste schwalbe, Champions tegen rivaal lukte Madrid In De Liverpool. zou Real (10 Over","['meeste', 'schwalbe', 'champion', 'tegen', 'rivaal', 'lukte', 'madrid', 'in', 'de', 'liverpool', 'zou', 'real', 'over']"
nl,"de dat verschillende scoorde scoren, op voor 'Juve'), 58e waren Manchester reeks nog van","['de', 'dat', 'verschillende', 'scoorde', 'scoren', 'op', 'voor', 'juve', 'waren', 'manchester', 'reek', 'nog', 'van']"
nl,"League Champions scoorde, een Bayern seizoen, van tweede de hij in waaronder kreeg keer, Wel","['league', 'champion', 'scoorde', 'een', 'bayern', 'seizoen', 'van', 'tweede', 'de', 'hij', 'in', 'waaronder', 'kreeg', 'keer', 'wel']"
nl,dan was een andere erg downloads exemplaren. Staten Koninkrijk in I het E.N.D. de,"['dan', 'wa', 'een', 'andere', 'erg', 'downloads', 'exemplaren', 'staten', 'koninkrijk', 'in', 'het', 'de']"
nl,"nummer Guetta heeft 7,5 artiesten. veel creÃ«ren het ooit Verenigde Rond met met meer meest","['nummer', 'guetta', 'heeft', 'artiesten', 'veel', 'creaa<<ren', 'het', 'ooit', 'verenigde', 'rond', 'met', 'met', 'meer', 'meest']"
nl,en van hit door Verenigd The Op hun juni producties een deze Gotta miljoen 1-positie.,"['en', 'van', 'hit', 'door', 'verenigd', 'the', 'op', 'hun', 'juni', 'producties', 'een', 'deze', 'gotta', 'miljoen', '-positie']"
nl,periode gehad Black het David de met album betrokken The in bijvoorbeeld,"['periode', 'gehad', 'black', 'het', 'david', 'de', 'met', 'album', 'betrokken', 'the', 'in', 'bijvoorbeeld']"
nl,beat. invloed Eyed werd de van nummer werd Feeling Guetta op miljoen,"['beat', 'invloed', 'eyed', 'werd', 'de', 'van', 'nummer', 'werd', 'feeling', 'guetta', 'op', 'miljoen']"
nl,het hij gezicht het Kim in voor and verliet Away. in Hemsworth zijn speelde,"['het', 'hij', 'gezicht', 'het', 'kim', 'in', 'voor', 'and', 'verliet', 'away', 'in', 'hemsworth', 'zijn', 'speelde']"
nl,land Home de verscheen eigen voor auditie Oorspronkelijk van door afleveringen rol in,"['land', 'home', 'de', 'verscheen', 'eigen', 'voor', 'auditie', 'oorspronkelijk', 'van', 'door', 'afleveringen', 'rol', 'in']"
nl,"blijkbaar zijn in aarde tijdens en macht, in hulp de kubus hen evacuatie contact neemt","['blijkbaar', 'zijn', 'in', 'aarde', 'tijdens', 'en', 'macht', 'in', 'hulp', 'de', 'kubus', 'hen', 'evacuatie', 'contact', 'neemt']"
nl,dat Captain Tesseract blijkt Selvig en moment tussen afgelegen de en enkele van America: geactiveerd.,"['dat', 'captain', 'tesseract', 'blijkt', 'selvig', 'en', 'moment', 'tussen', 'afgelegen', 'de', 'en', 'enkele', 'van', 'america', 'geactiveerd']"
nl,is die Loki beloofd in Eenmaal eind S.H.I.E.L.D.. viel First voor een de het aarde,"['is', 'die', 'loki', 'beloofd', 'in', 'eenmaal', 'eind', 'viel', 'first', 'voor', 'een', 'de', 'het', 'aarde']"
nl,zichzelf op op wormgat film de De steelt van Thor van van BifrÃ¶st in aarde,"['zichzelf', 'op', 'op', 'wormgat', 'film', 'de', 'de', 'steelt', 'van', 'thor', 'van', 'van', 'bifraaPst', 'in', 'aarde']"
nl,"Nick gekomen kubus. als en het kubus Clint (dezelfde hun zijn de Barton, aarde in","['nick', 'gekomen', 'kubus', 'al', 'en', 'het', 'kubus', 'clint', 'dezelfde', 'hun', 'zijn', 'de', 'barton', 'aarde', 'in']"
nl,"Trap[7], meisje van Parent ook genomineerd film positieve een Artist naast Award. voor publiek,","['trap', 'meisje', 'van', 'parent', 'ook', 'genomineerd', 'film', 'positieve', 'een', 'artist', 'naast', 'award', 'voor', 'publiek']"
nl,en groot Johansson Young nadat van de eerst Entertainment in in veel haar heeft,"['en', 'groot', 'johansson', 'young', 'nadat', 'van', 'de', 'eerst', 'entertainment', 'in', 'in', 'veel', 'haar', 'heeft']"
nl,"aandacht, rol kreeg, paard ze critici. en Blockbuster de en geweigerd voor brengen.[8] Johansson","['aandacht', 'rol', 'kreeg', 'paard', 'ze', 'critici', 'en', 'blockbuster', 'de', 'en', 'geweigerd', 'voor', 'brengen', 'johansson']"
nl,durende de Nadat in onzekerheid hoofdrol leeftijd ze vriendin haar van Whisperer.,"['durende', 'de', 'nadat', 'in', 'onzekerheid', 'hoofdrol', 'leeftijd', 'ze', 'vriendin', 'haar', 'van', 'whisperer']"
nl,meisje wijze Johansson de haar een Award Voor in The een opgemerkt Horse voor,"['meisje', 'wijze', 'johansson', 'de', 'haar', 'een', 'award', 'voor', 'in', 'the', 'een', 'opgemerkt', 'horse', 'voor']"
nl,"is van Globe Foreign prijs maakt Press toegekend en die de uit prijzenseizoen, als film","['is', 'van', 'globe', 'foreign', 'prijs', 'maakt', 'press', 'toegekend', 'en', 'die', 'de', 'uit', 'prijzenseizoen', 'al', 'film']"
nl,"De Golden onderscheiding deel en leden hoogtepunt Association uitreiking De de erkenning jaarlijkse van televisie,","['de', 'golden', 'onderscheiding', 'deel', 'en', 'leden', 'hoogtepunt', 'association', 'uitreiking', 'de', 'de', 'erkenning', 'jaarlijkse', 'van', 'televisie']"
nl,aankoop van allerlei vervoerbewijzen kan men bij voorkeur terecht aan de biljettenautomaat die ter beschikking,"['aankoop', 'van', 'allerlei', 'vervoerbewijzen', 'kan', 'men', 'bij', 'voorkeur', 'terecht', 'aan', 'de', 'biljettenautomaat', 'die', 'ter', 'beschikking']"
nl,"werd een nieuw stationsgebouw, ontworpen door architect Paul Nouille, in gebruik genomen. De dienstwoning van","['werd', 'een', 'nieuw', 'stationsgebouw', 'ontworpen', 'door', 'architect', 'paul', 'nouille', 'in', 'gebruik', 'genomen', 'de', 'dienstwoning', 'van']"
en,"test on an attribute, each branch represents the outcome of a test, and each leaf","['test', 'on', 'an', 'attribute', 'each', 'branch', 'represents', 'the', 'outcome', 'of', 'test', 'and', 'each', 'leaf']"
en,"description languages. In 2005, the 1985 paper in which the Yale shooting scenario was first","['description', 'language', 'in', 'the', 'paper', 'in', 'which', 'the', 'yale', 'shooting', 'scenario', 'wa', 'first']"
nl,zijn de loketten van dit station gesloten en is het een stopplaats geworden. Voor de,"['zijn', 'de', 'loketten', 'van', 'dit', 'station', 'gesloten', 'en', 'is', 'het', 'een', 'stopplaats', 'geworden', 'voor', 'de']"
en,"tuples. A decision tree is a flow-chart-like structure, where each internal (non-leaf) node denotes a","['tuples', 'decision', 'tree', 'is', 'flow-chart-like', 'structure', 'where', 'each', 'internal', 'non-leaf', 'node', 'denotes']"
en,"effect is that alive changes value (since alive was true before, this corresponds to alive","['effect', 'is', 'that', 'alive', 'change', 'value', 'since', 'alive', 'wa', 'true', 'before', 'this', 'corresponds', 'to', 'alive']"
en,"decision trees due to their added sparsity, permit non-greedy learning methods and monotonic constraints to","['decision', 'tree', 'due', 'to', 'their', 'added', 'sparsity', 'permit', 'non-greedy', 'learning', 'method', 'and', 'monotonic', 'constraint', 'to']"
en,"of occlusion, which formalizes the “permission to change” for a fluent. The effect of an","['of', 'occlusion', 'which', 'formalizes', 'the', 'apermission', 'to', 'changea', 'for', 'fluent', 'the', 'effect', 'of', 'an']"
en,one implication involved.) A solution proposed by Erik Sandewall was to include a new condition,"['one', 'implication', 'involved', 'solution', 'proposed', 'by', 'erik', 'sandewall', 'wa', 'to', 'include', 'new', 'condition']"
nl,"Het wordt ook gebruikt voor diegenen die nog de oorspronkelijke keltische taal, Welsh spreken.","['het', 'wordt', 'ook', 'gebruikt', 'voor', 'diegenen', 'die', 'nog', 'de', 'oorspronkelijke', 'keltische', 'taal', 'welsh', 'spreken']"
nl,"De deelstaat Tocantins is ingedeeld in 2 mesoregio's, 8 microregio's en 139 gemeenten.","['de', 'deelstaat', 'tocantins', 'is', 'ingedeeld', 'in', 'mesoregio', 'microregio', 'en', 'gemeenten']"
nl,werd eerst in Utrecht verboden en later op verzoek van de Staten van Utrecht ook,"['werd', 'eerst', 'in', 'utrecht', 'verboden', 'en', 'later', 'op', 'verzoek', 'van', 'de', 'staten', 'van', 'utrecht', 'ook']"
nl,werden gedreven. Zoals alle hoogleraren destijds verkreeg Voetius extra inkomsten door studenten in huis te,"['werden', 'gedreven', 'zoals', 'alle', 'hoogleraren', 'destijds', 'verkreeg', 'voetius', 'extra', 'inkomsten', 'door', 'studenten', 'in', 'huis', 'te']"
en,"well with an eleventh-place finish, marking his entry into the top tiers of international competition","['well', 'with', 'an', 'eleventh-place', 'finish', 'marking', 'his', 'entry', 'into', 'the', 'top', 'tier', 'of', 'international', 'competition']"
nl,"kritiseert hij onder meer de opvatting uit de strafrechtpraktijk, dat in juridische stukken zoals een","['kritiseert', 'hij', 'onder', 'meer', 'de', 'opvatting', 'uit', 'de', 'strafrechtpraktijk', 'dat', 'in', 'juridische', 'stukken', 'zoals', 'een']"
en,"the bridge provide, this stretch of the river is now only used by recreational and","['the', 'bridge', 'provide', 'this', 'stretch', 'of', 'the', 'river', 'is', 'now', 'only', 'used', 'by', 'recreational', 'and']"
nl,Vanaf het midden van de jaren zestig scoorde de band een hele reeks aan hits,"['vanaf', 'het', 'midden', 'van', 'de', 'jaren', 'zestig', 'scoorde', 'de', 'band', 'een', 'hele', 'reek', 'aan', 'hit']"
en,"The bridge originally had its own administration, using a seal depicting it, the oldest example","['the', 'bridge', 'originally', 'had', 'it', 'own', 'administration', 'using', 'seal', 'depicting', 'it', 'the', 'oldest', 'example']"
nl,"bereiding van een simpele mosterdsoort is mosterdzaad, azijn, zout en naar smaak eventueel kruiden voldoende","['bereiding', 'van', 'een', 'simpele', 'mosterdsoort', 'is', 'mosterdzaad', 'azijn', 'zout', 'en', 'naar', 'smaak', 'eventueel', 'kruiden', 'voldoende']"
en,"Originally written in 1991, PGP was one of the first freely and publicly available implementations","['originally', 'written', 'in', 'pgp', 'wa', 'one', 'of', 'the', 'first', 'freely', 'and', 'publicly', 'available', 'implementation']"
nl,Zwart mosterdzaad is scherper dan geel of bruin mosterdzaad. Dit houdt verband met een hoger,"['zwart', 'mosterdzaad', 'is', 'scherper', 'dan', 'geel', 'of', 'bruin', 'mosterdzaad', 'dit', 'houdt', 'verband', 'met', 'een', 'hoger']"
en,"funded by Rob Theis, general partner, Doll Capital Management and Terry Garnett, general partner, Venrock","['funded', 'by', 'rob', 'theis', 'general', 'partner', 'doll', 'capital', 'management', 'and', 'terry', 'garnett', 'general', 'partner', 'venrock']"
nl,en kan zowel mannelijke als vrouwelijke geslachtscellen produceren. De soort leeft in zeer vochtige omstandigheden,"['en', 'kan', 'zowel', 'mannelijke', 'al', 'vrouwelijke', 'geslachtscellen', 'produceren', 'de', 'soort', 'leeft', 'in', 'zeer', 'vochtige', 'omstandigheden']"
en,The only preserved work by Gomółka is a collection of 150 independent compositions to the,"['the', 'only', 'preserved', 'work', 'by', 'goma3aka', 'is', 'collection', 'of', 'independent', 'composition', 'to', 'the']"
nl,werd een aantal prinsbisdommen geseculariseerd en omgezet in wereldlijke vorstendommen. De laatste prinsbisdommen verdwenen ten,"['werd', 'een', 'aantal', 'prinsbisdommen', 'geseculariseerd', 'en', 'omgezet', 'in', 'wereldlijke', 'vorstendommen', 'de', 'laatste', 'prinsbisdommen', 'verdwenen', 'ten']"
en,"the 1000 years old cedar tree, and numerous shrines. The steps and the pagoda are","['the', 'year', 'old', 'cedar', 'tree', 'and', 'numerous', 'shrine', 'the', 'step', 'and', 'the', 'pagoda', 'are']"
nl,"zijn alle gouden objecten bruin gekleurd, gelijk aan de kleur van de paarden. De, tot","['zijn', 'alle', 'gouden', 'objecten', 'bruin', 'gekleurd', 'gelijk', 'aan', 'de', 'kleur', 'van', 'de', 'paarden', 'de', 'tot']"
en,"disciplines, fostering the interchange of ideas and information among investigators, and addressing the potential integration","['discipline', 'fostering', 'the', 'interchange', 'of', 'idea', 'and', 'information', 'among', 'investigator', 'and', 'addressing', 'the', 'potential', 'integration']"
nl,"meerdere keizers gebruikt, een jaartitel was dus niet uniek. De keizer bepaalde zelf wanneer de","['meerdere', 'keizers', 'gebruikt', 'een', 'jaartitel', 'wa', 'dus', 'niet', 'uniek', 'de', 'keizer', 'bepaalde', 'zelf', 'wanneer', 'de']"
en,"history of automobile, ball bearings and motorcycle production but both Kochs Adler and Durkopp's history","['history', 'of', 'automobile', 'ball', 'bearing', 'and', 'motorcycle', 'production', 'but', 'both', 'koch', 'adler', 'and', 'durkopp', 'history']"
nl,"speelt Heren 1 in de Overgangsklasse, terwijl Dames 1 wederom in de Hoofdklasse zal acteren","['speelt', 'heren', 'in', 'de', 'overgangsklasse', 'terwijl', 'dame', 'wederom', 'in', 'de', 'hoofdklasse', 'zal', 'acteren']"
en,He is well known for his research on the development and application of validity generalization,"['he', 'is', 'well', 'known', 'for', 'his', 'research', 'on', 'the', 'development', 'and', 'application', 'of', 'validity', 'generalization']"
nl,"vochtige beemden, rietlanden, populierenbossen, en een mergelgroeve. Mergel werd hier in dagbouw gewonnen voor bodemverbetering.","['vochtige', 'beemden', 'rietlanden', 'populierenbossen', 'en', 'een', 'mergelgroeve', 'mergel', 'werd', 'hier', 'in', 'dagbouw', 'gewonnen', 'voor', 'bodemverbetering']"
en,Twenty two of Skykomish's buildings — both homes and business — were temporarily moved during the cleanup,"['twenty', 'two', 'of', 'skykomish', 'building', 'both', 'home', 'and', 'business', 'were', 'temporarily', 'moved', 'during', 'the', 'cleanup']"
nl,hebben overigens een gemengd rechtssysteem. De Hadith geniet geen absoluut gezag en is geen primaire,"['hebben', 'overigens', 'een', 'gemengd', 'rechtssysteem', 'de', 'hadith', 'geniet', 'geen', 'absoluut', 'gezag', 'en', 'is', 'geen', 'primaire']"
en,conceptual foundations and practical feasibilities of contractually constructed “commons” and related bottom-up public domain initiatives,"['conceptual', 'foundation', 'and', 'practical', 'feasibility', 'of', 'contractually', 'constructed', 'acommonsa', 'and', 'related', 'bottom-up', 'public', 'domain', 'initiative']"
nl,wist in zijn eerste drie jaar bij PSV niet door te breken en moest voornamelijk,"['wist', 'in', 'zijn', 'eerste', 'drie', 'jaar', 'bij', 'psv', 'niet', 'door', 'te', 'breken', 'en', 'moest', 'voornamelijk']"
en,November of the same year he was appointed governor general and chief of garrisons regiment,"['november', 'of', 'the', 'same', 'year', 'he', 'wa', 'appointed', 'governor', 'general', 'and', 'chief', 'of', 'garrison', 'regiment']"
nl,"zoals is te zien op een gevelsteen uit de in 1945 verwoeste kerk, die in","['zoals', 'is', 'te', 'zien', 'op', 'een', 'gevelsteen', 'uit', 'de', 'in', 'verwoeste', 'kerk', 'die', 'in']"
en,"ubiquitous patrol boats fought with zeal, courage and heroism hitting Japanese warships with torpedoes when","['ubiquitous', 'patrol', 'boat', 'fought', 'with', 'zeal', 'courage', 'and', 'heroism', 'hitting', 'japanese', 'warship', 'with', 'torpedo', 'when']"
nl,"verbintenis werd het niet. Antonie hield er een jongere minnaar op na, Maximilian Mayr","['verbintenis', 'werd', 'het', 'niet', 'antonie', 'hield', 'er', 'een', 'jongere', 'minnaar', 'op', 'na', 'maximilian', 'mayr']"
en,reddish bark and the smaller twigs sometimes have bristly glandular hairs. The leaves are shiny,"['reddish', 'bark', 'and', 'the', 'smaller', 'twig', 'sometimes', 'have', 'bristly', 'glandular', 'hair', 'the', 'leaf', 'are', 'shiny']"
nl,de rechterkant een dvd in de doos geklikt worden. Aan de linkerkant kan vaak een,"['de', 'rechterkant', 'een', 'dvd', 'in', 'de', 'doos', 'geklikt', 'worden', 'aan', 'de', 'linkerkant', 'kan', 'vaak', 'een']"
en,"Her mental health deteriorated during the Second World War, Madeleine Ley definitely stopped writing. Her","['her', 'mental', 'health', 'deteriorated', 'during', 'the', 'second', 'world', 'war', 'madeleine', 'ley', 'definitely', 'stopped', 'writing', 'her']"
nl,onderhandelen. De missie mislukte doordat de Turken te hoge eisen stelden en doordat tegelijk de,"['onderhandelen', 'de', 'missie', 'mislukte', 'doordat', 'de', 'turken', 'te', 'hoge', 'eisen', 'stelden', 'en', 'doordat', 'tegelijk', 'de']"
en,in manufacturing and in chemistry. It is an alkali halide and occurs naturally as the,"['in', 'manufacturing', 'and', 'in', 'chemistry', 'it', 'is', 'an', 'alkali', 'halide', 'and', 'occurs', 'naturally', 'the']"
nl,wetenschappelijke naam van de soort is voor het eerst geldig gepubliceerd in 1894 door Kuwert,"['wetenschappelijke', 'naam', 'van', 'de', 'soort', 'is', 'voor', 'het', 'eerst', 'geldig', 'gepubliceerd', 'in', 'door', 'kuwert']"
